eng	uk	helsinki_translation_en_uk	helsinki_time_en_uk	facebook_translation_en_uk	facebook_time_en_uk	helsinki_translation_fine_tuned	helsinki_time_fine_tuned
He paid thorough attention to acquiring of practical skills by his subordinates during field trainings.	Особливо прискіпливо він ставився до набуття підлеглими практичних навичок під час польових виходів.	Він уважно брав участь у навчанні підлеглих, щоб набути практичних навичок.	0.5617673397064209	Він звернув глибоку увагу на те, щоб підлеглі вчилися на практиці під час польових тренувань.	3.9133732318878174	Він уважно брав участь у здобутті практичних навичок своїх підлеглих під час тренувань на полі.	1.6529526710510254
Your entire team can join the same Hangout from their desktop, laptop, tablet or phone with the same easy-to-use experience.	Уся ваша команда може легко приєднатися до сеансу із будь-якого пристрою: настільного комп’ютера, ноутбука, планшета чи телефона.	"Вся ваша команда може приєднатися до того самого "" Погонича "" зі стільниці, ноутбука, планшета або телефона з таким самим простим досвідом користування."	1.0245463848114014	Уся ваша команда може приєднатися до такого Hangout з їхнього робочого столу, ноутбука, планшета чи телефону з таким же простим досвідом.	5.725736618041992	"Вся ваша команда може приєднатися до того самого ""Ханґу"" зі свого робочого столу, ноутбука, планшета або телефона з таким самим легким досвідом користування."	3.2773208618164062
Your main goal in the game - do not get caught in the clutches of a neighbor until you change yourself for him all sorts of trouble, which should bring it to the boiling point.	Ваше головне завдання в грі - не попастися в лапи сусіда, поки Ви підлаштовуєте йому всілякі неприємності, які повинні довести його до точки кипіння.	Ваша головна мета - не потрапити в лапи сусіда, аж поки ви не зміните свій спосіб життя на будь - який клопіт, що приведе її до кипіння.	1.039231300354004	Ваша головна мета в грі - не застрягнути в клавішах сусіда, поки ви не зміните себе для нього всі типи проблем, які повинні принести його до точки кипіння.	6.756643772125244	Ваша головна мета у грі - не потрапити в лапи сусіда, поки ви не зміните себе на всі види неприємностей, що приведе його до кипіння.	2.9015822410583496
However, let’s see, what you will face when trying to create your own company:	Однак давайте розберемося, з чим вам доведеться зіткнутися при спробі створити власну компанію.	Проте, давайте подивимося, те, що ви будете зустрічати, коли будете старатись створити вашу власну компанію:	0.634803295135498	Однак, давайте поглянемо, з чим ви зіткнетеся, намагаючись створити власну компанію:	3.56779146194458	Проте, давайте подивимося, те, що ви зустрінете, коли спробуєте створити вашу власну компанію:	1.3968794345855713
In the process of the scuffle they damaged photographic equipment of correspondents of Ukrainian News agency Serhii Bobok and Fotolenta's Serhii Kozlov.	"У процесі бійки було пошкоджено фотоапаратури кореспондентів інформаційних агентств Українські Новини Сергія Бобка й ""Фотолента"" Сергія Козлова."	У процесі бешкетування вони пошкодили фотографічне обладнання кореспондентів українського інформаційного агентства Сергії Бобок і сергієвого Козлова.	1.1548514366149902	Під час сварки вони пошкодили фотообладнання кореспондентів ukraińskiej агенції новин Сержі Бобока та Фотоленти Сержі Козлова.	5.750460863113403	У процесі збивання вони пошкодили фотографічне обладнання кореспондентів українського інформаційного агентства Сергії Бобок і сергієвого Козлова, сергіє.	4.185892820358276
"Then it was — we started seeing a change and I kept encouraging him but we started seeing a change in him to where he said, ""I'm not just doing this for you anymore mom, I'm doing this for me."""	Потім ми почали бачити зміни, і я продовжувала підбадьорювати його, але ми помітили зміни в ньому, коли він сказав: «Я більше не роблю це лише для тебе, мамо, я роблю це для себе».	"Тоді ми почали бачити зміну, і я продовжував підбадьорювати його, але ми почали бачити зміну в ньому, де він сказав: ""Я не просто роблю це для вас, мама, я роблю це для мене."""	1.171647310256958	"Тоді ми побачили зміну, і я продовжував підбадьорювати його, але ми побачили зміну в ньому, коли він сказав: """" Я більше не роблю це тільки для тебе, мамо, я роблю це для мене """"."	8.235190868377686	"Потім ми почали бачити зміну, і я продовжував підбадьорювати його, але ми почали бачити зміну в ньому, на якій він сказав: ""Я не просто роблю це для вас, мама, я роблю це для себе."""	4.228882789611816
At the discretion of the responsible manager, for some items, you can select several pieces of similar devices.	На розсуд відповідального менеджера, по окремих позиціях, можливий вибір кількох штук однотипних приладів.	З огляду на думку відповідального менеджера, для деяких з пунктів ви можете обрати декілька подібних пристроїв.	0.7129244804382324	В discretion відповідального менеджера, для деяких речей, ви можете вибрати декілька схожих пристроїв.	4.010586500167847	За думкою відповідального менеджера, для деяких елементів ви можете обрати декілька подібних пристроїв.	1.9571032524108887
Classification of Administrative and Territorial Division of Ukraine (COATU)	Класифікатор об’єктів адміністративно-територіального устрою України (КОАТУУ)	Класифікація Адміністративного і Терріального дивізії України (COATU) Noun, a currency	0.8996055126190186	класифікація Адміністративного та Территориального підрозділу Украины (COATU)	2.9240622520446777	Класифікація Адміністративного та Терріторального дивізії України (COATU)	2.0283560752868652
Only those who took their own lives were buried without a Christian ceremony, outside of churchyard wall.	Виняток становили самогубці, котрих ховали без християнського обряду за муром цвинтаря.	Тільки тих, що забирали своє життя були поховані без християнської церемонії, поза муром церковного подвір'я.	0.6998167037963867	Лише ті, хто взяв власне життя, були поховані без християнської церемоні, за межами церкви.	4.335527420043945	Тільки тих, хто забирав собі життя, ховали без християнської церемонії, поза стіною церковного подвір'я.	2.7913639545440674
The race of Elves originated near here, though their original home of Cuiviénen no longer existed by the Third Age.	Ельфи вперше з'явилися саме там, на крайньому сході. Їх батьківщини Куівіенен в Третю епоху вже не існувало.	Забіг ельфів почався тут, хоч їхній оригінальний дім Куівієну вже не існував у Третій Добі.	0.7453033924102783	Раса elfів виникла десь тут, хоча їхній рідний дім Куївіенен вже не існував до Третього віку.	4.91063928604126	Раса ельфів почалася тут неподалік, хоча їхня початкова домівка Куівієн більше не існувала у Третьому віці.	2.164966583251953
Fun party Presenter of the corporate holiday – it is a separate area of creativity.	Робота ведучого на корпоративному святі – це окремий напрямок творчості.	Весела вечірка корпоративного свята ♫ Це окрема область творчості.	0.511772632598877	Розважна вечірка Подарувач корпоративного відпочинку - це окрема сфера творчості.	2.9877007007598877	Грандіозний учасник корпоративного свята ♫ Це окрема область творчості.	1.6247966289520264
Now it's time to look at how to place your boxes in the right place in relation to the viewport, and one another.	Тепер час розглянути розташування ваших блоків у правильному місці, по відношенню до точки огляду, і відносно один одного.	Тепер час подивитися, як покласти свої коробки у правильному місці у зв'язку з полем зору, та один з одним.	0.7638556957244873	Тепер прийшов час подивитися, як помістити коробки в правильному місці, в залежності від порту зору, і один від одного.	5.267984390258789	Настав час подивитися, як покласти коробки у правильному місці, у зв'язку з полем зору, та один з одним.	2.0668838024139404
He gave us a deadline.	Він встановив граничний термін.	Він дав нам термін.	0.19591426849365234	Він дав нам кінцевий термін.	1.3400819301605225	Він дав нам термін.	0.5794887542724609
Volunteers cannot replace proper military or foreign intelligence agencies or wage an all-out cyberwar.	Волонтери не можуть замінити собою воєнну чи зовнішню розвідку чи вести тотальну кібервійну.	Добровольці не можуть замінити відповідні військові або іноземні агентури розвідки або профінансувати всю кібервійну.	0.7167360782623291	Добровольці не можуть замінити справжнє військове чи іноземне розвідувальне агентство або вести всюдису кібер-війну.	5.183213233947754	Добровольці не можуть замінити відповідні військові або іноземні агентури розвідки або вести повну кібервійну.	1.9554355144500732
You can sow seeds in November – during winter they will endure a natural stratification, and in spring you will get sturdy healthy shoots that will bloom in time.	Можна посіяти насіння в листопаді – за зиму воно пройде природну стратифікацію, і навесні ви отримаєте міцненькі здорові сходи, які вчасно зацвітуть.	Ви можете посіяти насіння в листопаді ⇩ взимку вони витримають природне відсіювання, а навесні ви отримаєте міцні здорові паростки, які розквітатимуть у часі.	1.1213715076446533	Ви можете сіяти насіння в листопаді - взимку вони переживуть природну стріфікацію, а весною ви отримаєте міцні здорові стовбури, які з 'являться вчасно.	9.403733968734741	Ви можете посіяти насіння в листопаді ♫ протягом зими вони витримають природну стратизацію, а навесні ви отримаєте міцні здорові пагони, які розквітатимуть у часі.	3.178640365600586
Thank you for your donation! There will be a benevolent Collection for “Andrew’s Pence” on Sunday, February 28, 2016 to support our Patriarch, His Beatitude Svyatoslav Shevchuk and the building of Resurrection Cathedral Church in Kyiv (Patriarchal Sobor.)	Дякую за ваш донат! У неділю, 28 лютого ц.р. відбудеться збірка на «Андріївський Гріш» для підтримки нашого патріарха Святослава і будівництва Катедрального Собору Воскресіння у Києві.	Дякую за вашу пожертву! буде доброзичлива збірка для }Анжевса Пенса в неділю, 28 лютого 2016 р., щоб підтримати нашого патріарха, Його Вимога Світослава Шевчука і будування кафедральної церкви Воскресення в Києві (Патріарха Собора).	2.228898763656616	"Дякую за ваші пожертви! Неділя, 28 Февраля 2016 року, буде створено доброчинне колекцію для """" Андрієвого пенса """", щоб підтримати нашого Патриарха, Блаженства Святослава Шевчука, та будівлю собору воскресенья в Київі (Патриарський Собор.)"	17.33240818977356	"Дякуємо вам за вашу пожертву! У неділю 28 лютого 2016 року буде доброзичлива збірка для ""Анжерос Пенс"" для підтримки нашого патріарха, Свіататослава Шевчука"" та будівництво кафедральної церкви Воскресіння у Києві (Патріархал Собор)."	5.097046375274658
Please check if there is any reason as below:	Перевірте, чи є якісь причини, наведені нижче:	Будь ласка, перевірте, чи немає причин, на зразок нижче:	0.5281131267547607	Прошу вас перевірити, чи є якісь причини:	3.612361431121826	Будь ласка, перевірте, чи існує якась причина на наступне:	1.6060824394226074
Nevertheless, after thoroughly picking and also testing all Garcinia Cambogia items presently on the market, we have involved the verdict that choosing 100 % pure product needs screening in a lab.	Проте, після ретельного вибору, а також тестування всіх елементів гарцинии камбоджійської в даний час на ринку, ми залучили вердикт, що при виборі 100% чистий продукт потребує скринінг в лабораторії.	Тим не менш, після ретельного підбору та тестування всіх речей Ґарчінії Камбоджіа на ринку, ми взяли участь у вердикті, що обираємо 100% чистого продукту, який потребує перевірки в лабораторії.	1.5387918949127197	Тим не менше, після детального відбору і також тестування всіх Garcinia Cambogia речей на ринку, ми долучилися до виroku, що вибір 100% чистого продукту потребує скринінгу в лабораторії.	10.653584957122803	Тим не менш, після ретельного підбору та тестування всіх речей Ґарсінії Камбоджіа на ринку, ми взяли участь у вердикті, що обравши 100% чистого продукту, потрібно перевірити в лабораторії.	4.23302698135376
If the fish will be too much to achieve biological balance will not succeed.	Якщо рибок буде занадто багато домогтися біологічної рівноваги не вдасться.	Якщо риби не матимуть біологічної рівноваги, то це не матиме успіху.	0.5391397476196289	Якщо рибою буде занадто багато, щоб досягнути біологічного балансу, це не спрацює.	4.904807090759277	Якщо риба буде занадто великою, щоб досягти біологічного балансу, вона не матиме успіху.	1.9635310173034668
Different types of customers have various features, and they have different preferences for the above four requirements.	Різні типи клієнтів мають різні функції, і вони мають різні уподобання для чотирьох вищевказаних вимог.	Різні типи покупців мають різні особливості, і вони мають різні переваги до вищезгаданих чотирьох вимог.	0.6404190063476562	Різні типи споживачів мають різні характеристики, і вони мають різні переваги для цих чотирьох вимог.	5.238347053527832	Різні типи клієнтів мають різні особливості, і вони мають різні переваги для вищезгаданих чотирьох вимог.	1.6581857204437256
Bandera, 52, Chervonograd, Lviv area,	Бандери, 52, Червоноград, Львівська область,	Бандера, 52, Червоград, область Львова,	0.5865535736083984	Бандера, 52, Червоноград, Львов,	3.648674726486206	Бандера, 52, Червоград, область Львова,	1.0923454761505127
If you a few times changed the filter conditions, you can change these filter clicking on the icons: Previous filter and Next filter.	Якщо ви кілька разів змінювали умови фільтрації даних, ви можете перемикатися між цими фільтрами, натискаючи по іконкам Попередній фільтр і Наступний фільтр.	Якщо ви декілька разів змінили умови фільтрування, ви можете змінити ці параметри фільтрування, натиснувши на піктограми: Попередній фільтр і Наступний.	0.8193838596343994	Якщо ви кілька разів змінили умови відфільтрування, ви можете змінити ці відфільтри, натискаючи на іконки: Поprzedній відфільтр та Наступний відфільтр.	8.285433053970337	Якщо ви декілька разів змінили умови фільтрування, ви можете змінити ці умови фільтрування, натиснувши на піктограми: Попередній фільтр і Наступний.	2.028550148010254
He started boxing at 13 and 4 years later he has won Europe’s champion title among juniors, he was the champion of Ukraine 5 times.	Боксом почав займатися у 13 років і через 4 роки вже завоював звання чемпіона Європи серед юніорів, був чемпіоном України 5 разів.	Він почав бокс в 13 і 4 роки пізніше він виграв у Європі чемпіонат серед підлітків, він був чемпіоном України 5 разів.	0.9097805023193359	Він почав боксувати у 13 років, а через 4 роки він одержав титул чемпіона Європи серед юниорів, він був чемпіоном Украины 5 разів.	6.041708707809448	Він почав бокс на 13 і 4 роки пізніше він виграв чемпіонат Європи серед підлітків, він був чемпіоном України 5 разів.	1.6886036396026611
In addition, this program will help to pick up on the hair color and hairstyle photo.	Крім того дана програма допоможе на підібрати колір волосся і стрижку по фото.	Крім того, завдяки цій програмі можна отримати фотографію кольору волосся та зачіски.	0.5668151378631592	До того ж, ця програма допоможе розібратися на колірі волосся і фото.	4.548611879348755	Крім того, ця програма допоможе підбирати колір волосся та його зачіску.	1.188042163848877
Biological psychologists seek an understanding of the emergent properties of brains, linking the discipline to neuroscience. As social scientists, psychologists aim to understand the behavior of individuals and groups.	Біологічні психологи прагнуть зрозуміти емерджентні властивості мозку, пов'язуючи цю дисципліну з неврологією. Як соціальні науковці, психологи прагнуть зрозуміти поведінку окремих людей і груп.	Біологічні психологи шукають розуміння властивостей мозку, які з'єднують дисципліну з неврологією. психологи намагаються зрозуміти поведінку окремих осіб та груп.	1.0154221057891846	Біологічні психологи прагнуть зрозуміти з 'явлені властивості мозку, поєднуючи науку з нейробіологією. Як соціальні вчені, психологи прагнуть зрозуміти поведінку людей та груп.	8.298279047012329	Біологічні психологи шукають розуміння зовнішніх властивостей мозку, пов'язуючи дисципліну з неврологією. Як соціологи, психологи мають намір зрозуміти поведінку окремих осіб та груп.	3.0534305572509766
