eng	uk	helsinki_translation_en_uk	helsinki_time_en_uk	facebook_translation_en_uk	facebook_time_en_uk	helsinki_translation_fine_tuned	helsinki_time_fine_tuned
The ancient civilizations of Egypt, Greece, China, India, and Persia all engaged in the philosophical study of psychology. In Ancient Egypt the Ebers Papyrus mentioned depression and thought disorders.	Стародавні цивілізації Єгипту, Греції, Китаю, Індії та Персії займалися філософським вивченням психології. У Стародавньому Єгипті в папірусі Еберса згадується про депресію та розлади мислення.	У давньоєгипетському папірусі Еверса згадувалися про депресію і розлади мислення.	0.6867043972015381	Стародавні цивілізації Єгипту, Греції, Китаю, Індії та Персии всі брали участь у філософських дослідженнях психології. У Стародавньому Єгипті Еберський Папір згадував депресію та розлади мислення.	13.0345778465271	Давні цивілізації Єгипту, Греції, Китаю, Індії та Персії всі займалися філософським дослідженням психології. У Давньому Єгипті папірус Еверса згадував про депресію та розлади мислення.	1.888152837753296
A central idea of the Upanishads and other Vedic texts that formed the foundations of Hinduism was the distinction between a person's transient mundane self and their eternal, unchanging soul.	Головною ідеєю Упанішад та інших ведичних текстів, що лягли в основу індуїзму, було розрізнення між минущим, земним «я» людини та її вічною, незмінною душею.	Центральна ідея Упанішадів та інших ведкових текстів, які сформували підвалини індуїзму, полягала в тому, що різниця між скороминущим повсякденним ямою людини та її вічною, незмінною душею.	1.5180718898773193	Центральною ідеєю у Upanishaдах та інших ведичних текстах, що складали основу індуізму, було розмежування між мирним мирним собою людини та її вечною, незмінною душею.	9.484444618225098	Центральна ідея Упанішадів та інших Vedic текстів, які сформували основи індуїзму, полягала у розрізненні тимчасового світського я людини та її вічної, незмінної душі.	3.081604242324829
She believed a child should be recognized as their own person with their own right and have each session catered to the child's specific needs.	Вона вірила, що дитина повинна бути визнана власною особистістю з власними правами, і що кожна сесія повинна бути пристосована до конкретних потреб дитини.	Вона вірила, що дитину слід визнавати своєю особою з власним правом і що кожна сесія задовольняла особливі потреби дитини.	0.8648481369018555	Вона вважала, що дитина повинна бути оцінена як її особистість з її власним правом і що кожна сеанс повинна бути налаштована на її специфічні потреби.	6.9919114112854	Вона вірила, що дитину слід визнати власною особою з власним правом, і що кожна сесія задовольнила особливі потреби дитини.	1.8502013683319092
This helped build a strong therapeutic alliance with child patients, which allows psychologists to observe their normal behavior. She continued her research on the impact of children after family separation, children with socio-economically disadvantaged backgrounds, and all stages of child development from infancy to adolescence.	Це допомогло побудувати міцний терапевтичний альянс з дітьми-пацієнтами, що дозволяє психологам спостерігати за їхньою нормальною поведінкою. Вона продовжила дослідження впливу дітей після розлучення сімей, дітей з соціально-економічно неблагополучних сімей, а також усіх етапів розвитку дитини від немовляти до підліткового віку.	Вона продовжувала свої дослідження щодо впливу дітей на розлуку сім'ї, дітей із соціально-економічним походженням, і всіх етапів розвитку дітей з раннього дитинства до підліткового віку.	1.1643333435058594	Це допомогло побудувати міцну терапевтичну асоціацію з дітьми, яка дозволяє психологам спостерігати за їхнім звичайним поведінком. Вона продовжувала досліджувати вплив дітей після розлучення сім 'ї, дітей з соціально-економічним розбіжністю, і всі стадії розвитку дитини від малюка до підліткового віку.	16.332146167755127	Це допомогло побудувати міцний терапевтичний альянс з дитячими пацієнтами, що дозволило психологам спостерігати за їх нормальною поведінкою. Вона продовжувала своє дослідження щодо впливу дітей після сімейного проживання, дітей із соціально-економічним походженням, і всіх етапів розвитку дітей з раннього дитинства до підліткового віку.	6.734667778015137
Mary Ainsworth's work centered around attachment theory. Building off fellow psychologist John Bowlby, Ainsworth spent years doing fieldwork to understand the development of mother-infant relationships.	Робота Мері Ейнсворт була зосереджена на теорії прив'язаності. Спираючись на дослідження свого колеги-психолога Джона Боулбі, Ейнсворт роками проводила польові дослідження, щоб зрозуміти розвиток стосунків між матір'ю та немовлям.	Робота Мері Ейнсворта зосереджена на теорії про прив'язаність. щоб зрозуміти розвиток стосунків між матір'ю і нефантом.	0.9139308929443359	Мері Айнсворт зосередилася на теорії прив 'язаності. Використовуючи колегу психолога Джона Боулбі, Айнсворт роками займався полевою працею, щоб зрозуміти розвиток стосунків між матір' ю та дітьми.	12.33656644821167	Робота Мері Ейнсворт зосереджена навколо теорії прив'язаності. Побудова співписьменника Джона Болбі, Ейнсворт витратила роки на польову роботу, щоб зрозуміти розвиток стосунків між матір'ю і нефритом.	5.058336019515991
Behavioral researchers have developed a treatment known as behavior modification, which is used to help individuals replace undesirable behaviors with desirable ones.	Дослідники поведінки розробили метод лікування, відомий як модифікація поведінки, який використовується для того, щоб допомогти людям замінити небажану поведінку на бажану.	Дослідники в галузі поведінки розробили метод, відомий як зміна поведінки, який допомагає людям замінити небажану поведінку бажаними.	0.7787120342254639	Дослідники поведінки розробили терапію, яку називають модифікацією поведінки, яка допомагає людям замінити небажані поведінки на бажані.	6.865112066268921	Дослідники з питань поведінки розробили метод, відомий під назвою зміна поведінки, який використовується для того, щоб допомогти людям замінити небажану поведінку бажаними.	3.178435802459717
Psychology encompasses many subfields and includes different approaches to the study of mental processes and behavior.	Психологія охоплює багато підгалузей і включає різні підходи до вивчення психічних процесів і поведінки.	Психологія охоплює багато підпільних сфер і включає в себе різні підходи до вивчення розумових процесів та поведінки.	0.7458586692810059	Психологія включає в себе багато підвидів і включає в себе різні підходи до вивчення психічних процесів та поведінки.	4.91958212852478	Психологія охоплює багато полів і включає різні підходи до вивчення розумових процесів та поведінки.	1.9715678691864014
School psychology combines principles from educational psychology and clinical psychology to understand and treat students with learning disabilities; to foster the intellectual growth of gifted students; to facilitate prosocial behaviors in adolescents;	Шкільна психологія поєднує принципи педагогічної та клінічної психології для розуміння та лікування учнів з труднощами у навчанні; сприяння інтелектуальному зростанню обдарованих учнів; сприяння просоціальній поведінці підлітків;	Шкільна психологія поєднує принципи з освітньої психології та клінічної психології, щоб зрозуміти і лікувати студентів з порушеннями здатності навчатися; сприяти інтелектуальному росту обдарованих учнів; сприяти суспільній поведінці у підлітків;	1.4168384075164795	Школа психології об 'єднує принципи з педагогічної психології та клінічної психології, щоб зрозуміти та лікувати студентів з нездатністю до навчання, щоб підтримувати інтелектуальний розвиток талановитих студентів, щоб сприяти просоціальному поведінці підлітків;	10.448050737380981	Шкільна психологія поєднує принципи з освітньої психології та клінічної психології для того, щоб зрозуміти та лікувати студентів з порушеннями здатності навчатися; щоб сприяти інтелектуальному росту обдарованих учнів; сприяти просоціальній поведінці підлітків;	5.230772495269775
The field was at first called economic psychology or business psychology; later, industrial psychology, employment psychology, or psychotechnology.	Спочатку цю галузь називали економічною психологією або бізнес-психологією, пізніше - індустріальною психологією, психологією зайнятості або психотехнологією.	Спочатку ця галузь називалася економічною психологією або бізнес психологією; пізніше - індустріальна психологія, психологія зайнятості, або психотехнологія.	1.0754849910736084	Спочатку ця галузь називалася економікою чи бізнес-психологією, пізніше - промисловою психологією, робототехнікою або психотехнологією.	6.940826177597046	Спочатку ця галузь називалася економічною психологією або бізнес-психологією; пізніше промислова психологія, психологія зайнятості, або психотехнологія.	2.8237345218658447
"Research has shown that compared to the ""whole word"" or ""whole language"" approach, the phonics approach to reading instruction is more efficacious."	Дослідження показали, що порівняно з підходом «цілого слова» або «цілої мови», фонетичний підхід до навчання читання є більш ефективним.	"Дослідження показали, що у порівнянні з підходом ""ціле слово"" або ""цілою мовою,"" підхід до читання є більш ефективним."	1.0062382221221924	"Дослідження показали, що в порівнянні з """" повним словом """" або """" повною мовою """" підхід fonіки до читання є ефективнішим."	8.215519905090332	"Дослідження показали, що у порівнянні з підходом ""ціле слово"" або ""цілою мовою"" підхід до читання більш дієвий."	2.9700000286102295
The American Psychological Association has advanced a set of ethical principles and a code of conduct for the profession.	Американська психологічна асоціація розробила ряд етичних принципів і кодекс поведінки для цієї професії.	Американська психологічна асоціація видала ряд етичних принципів і норм поведінки для цієї професії.	0.5684514045715332	Американська психологічна асоціація запровадила низку етичних принципів та кодекс поведінки для професії.	5.486525058746338	Американська психологічна асоціація просунула низку етичних принципів та кодекс поведінки для цієї професії.	1.8031392097473145
Justice - an understanding that psychology must be for everyone's benefit, and that psychologists take special care to avoid unjust practices as a result of biases or limitations of expertise.	Справедливість - розуміння того, що психологія має бути на користь кожному, і що психологи особливо дбають про те, щоб уникати несправедливих практик внаслідок упередженості чи обмеженості знань.	Правосуддя - розуміння, що психологія повинна бути на користь кожному, і що психологи особливо дбають про те, щоб уникнути несправедливості внаслідок упереджень або обмежень досвіду.	1.0651531219482422	Справедливість - це розуміння того, що психологія повинна бути корисною для всіх, і що психологи мають бути особливо обережні, щоб уникнути несправедливої практики в результаті упереджень чи обмежень знань.	8.750429153442383	Правосуддя - розуміння того, що психологія повинна бути на користь кожному, і що психологи особливо дбають про те, щоб уникнути несправедливості в результаті упереджень або обмежень досвіду.	2.9650566577911377
Animal research is influential in psychology, while still being debated among academics. 	Дослідження на тваринах мають великий вплив на психологію, але все ще залишаються предметом дискусій серед науковців. 	Дослідження тварин має вплив на психологію, тоді як дискутують про них між науковцями.	0.5838065147399902	Дослідження тварин мають вплив на психологію, хоча й досі дискутують між науковцями.	4.278510332107544	Дослідження тварин має вплив на психологію, поки ще ведуть дискусії серед вчених.	1.2700963020324707
In contrast, human environments and genetic backgrounds vary so widely, and depend upon so many factors, that it is difficult to control important variables for human subjects.	На противагу цьому, людське середовище і генетичний фон варіюються настільки широко і залежать від багатьох факторів, що важко контролювати важливі для людини змінні.	На противагу цьому, людське середовище та генетичне походження настільки різняться і залежать від багатьох факторів, що важко контролювати важливі змінні, необхідні для життя людей.	0.8677554130554199	Натомість, людські середовища та генетичний фон дуже сильно відрізняються, і залежать від багатьох факторів, що важко контролювати важливі змінні для людських суб 'єктів.	7.398641586303711	На противагу цьому, людське середовище та генетичне походження настільки різняться і залежать від багатьох факторів, що важко контролювати важливі змінні для питання.	2.622453212738037
A rat undergoing a Morris water navigation test used in behavioral neuroscience to study the role of the hippocampus in spatial learning and memory	Щур проходить тест Морріса на водну навігацію, який використовується в поведінковій нейронауці для вивчення ролі гіпокампу в просторовому навчанні та пам'яті.	Для вивчення ролі гіпокампу в просторовому навчанні і пам'яті щура, який проводить аналіз води Морріса, який використовувався у поведінковій неврології.	1.2055778503417969	Рата, яка проходить тест на водну навігацію Моріса, що використовується в біологічних неврології, щоб вивчати роль гіпокампу у просторовому вчинні та пам 'яті	8.370333194732666	Риса, що проходить тест на навігацію води Морріса, який використовується у поведінковій неврології для вивчення ролі гіпокампу у просторовому навчанні та пам'яті.	4.31827187538147
Since modern computers process information quickly, simulations can be run in a short time, allowing for high statistical power.	Оскільки сучасні комп'ютери обробляють інформацію швидко, симуляції можна запускати за короткий час, забезпечуючи високу статистичну потужність.	Оскільки сучасні комп'ютери швидко обробляють інформацію, симуляції можна виконувати за короткий час, що дає змогу отримати високу статистичну потужність.	0.8349406719207764	Оскільки сучасні комп 'ютери швидко обробляють інформацію, симуляції можуть відтворюватися протягом короткого часу, що дає високу статистику.	7.122270345687866	Оскільки сучасні комп'ютери швидко обробляють інформацію, симуляції можна запустити за короткий час, що дає змогу отримати високу статистичну потужність.	1.9773352146148682
For example, in research on the best way to affect reading achievement in the first three grades of school, school administrators may not permit educational psychologists to randomly assign children to phonics and whole language classrooms, in which case the psychologists must work with preexisting classroom assignments.	Наприклад, під час дослідження найкращого способу вплинути на успішність читання в перших трьох класах школи шкільна адміністрація може не дозволити педагогічним психологам випадковим чином розподіляти дітей по класах з фонетики та вивчення цілих мов, і в цьому випадку психологи повинні працювати з уже існуючими розподілами по класах.	Наприклад, у дослідженні найкращого способу вплинути на досягнення читання в перших трьох класах школи, то шкільні адміністратори не можуть дозволити шкільним психологам випадково призначати дітей на факони й цілі мовні класи, в якому то разі психологи мусять працювати з вже існуючим класним призначенням.	1.6450963020324707	Наприклад, в дослідженні найкращого способу впливу на успішність читання у перших трьох класах школи, адміністратори школи можуть не дозволити шкільним психологам випадково надавати дітей в класи fonіки та цілої мови, в цьому випадку психологи повинні працювати з уже наявними уроками.	13.43517279624939	Наприклад, у дослідженні найкращого способу впливу на досягнення читання у перших трьох класах школи адміністратори шкільних закладів не можуть дозволити освітнім психологам випадково призначати дітей на факони та цілі мовні класи, у цьому випадку психологи повинні працювати з вже наявними класними завданнями.	4.845952033996582
