eng	uk	helsinki_translation_en_uk	helsinki_time_en_uk	facebook_translation_en_uk	facebook_time_en_uk	helsinki_translation_fine_tuned	helsinki_time_fine_tuned
People around me say I’m too sensitive. But how do I learn not to feel pain?	Люди навколо кажуть, що я занадто чутливий. Але як навчитися не відчувати біль?	Люди вокруг меня говорят, что я слишком чувствительный, но как я учусь не чувствовать боль?	1.2784912586212158	Люди навколо мене кажуть, що я занадто чутлива. Але як я вчусь не відчувати болю?	3.8653793334960938	Люди навколо мене кажуть, що я занадто чутливий. Але як я вчуся не відчувати болю?	2.090132474899292
There are days when I just don’t want to leave my room. The world feels too heavy for me.	Бувають дні, коли я просто не хочу виходити з кімнати. Світ здається занадто важким для мене.	є дні, коли я просто хочу вийти з моєї кімнати... світ відчуває себе занадто важким для мене.	0.9548001289367676	Є дні, коли я просто не хочу піти з кімнати. Світ відчувається надто складним для мене.	3.954633951187134	Бувають дні, коли я просто не хочу виходити зі своєї кімнати. Світ відчуває себе занадто важким для мене.	1.8123903274536133
When I ask for help, people say, “Pull yourself together.” But how?	Коли я прошу про допомогу, люди кажуть: «Зберися». Але як?	Коли я прошу про допомогу, люди кажуть:	0.9181516170501709	"Коли я запитую про допомогу, люди кажуть: """" Заспокоїться разом """". Але як?"	3.4367072582244873	"Коли я прошу про допомогу, люди кажуть: ""Закрийся разом."" Але як?"	1.8402173519134521
It’s hard for me to say “no,” even when I don’t want to do something. 	Мені складно сказати «ні», навіть коли я не хочу чогось робити. 	"Мені важко сказати ""no,"" навіть коли я не хочу щось робити."	0.953930139541626	"Мені важко сказати """" ні """", навіть коли я не хочу чогось робити."	2.939234733581543	"Мені важко сказати ""Ні,"" навіть коли я не хочу щось робити."	1.1527526378631592
I feel like I’ve lost myself. I don’t know who I am or what I want from life.	Я відчуваю, що втратив самого себе. Не знаю, хто я і чого хочу від життя.	Я не знаю, хто я, чи що я хочу від життя.	0.866757869720459	Я відчуваю себе втраченою. Я не знаю, хто я, чи чого я хочу від життя.	3.5491116046905518	Я відчуваю, що я втратив себе. Я не знаю, хто я або що я хочу від життя.	2.1753146648406982
You will gain an understanding of the human factors in aviation, airline strategic management, and airport operational management as well as have the opportunity to undertake an internship course (aviation practicum).	Ви отримаєте розуміння людських факторів у авіації, стратегічному управлінні авіапідприємствами та операційному управлінню аеропортом, а також зможете пройти стажування (авіаційний практикум).	Ви зрозумієте людські фактори в авіації, стратегічному управлінні літаками, управлінні аеропортом, а також матимете нагоду пройти курс інтерв'ю.	2.371633291244507	Ви зрозумієте людські фактори в авіації, стратегічному менеджменті авіалінії та операційному менеджменті аеропорту, а також отримаєте можливість пройти інтернійський курс (практика авіації).	6.930450201034546	Ви здобудете розуміння людських факторів в авіації, стратегічному управлінні авіаційними літаками, управлінні аеропортами, а також матимете можливість розпочати курс інтерв'ю (автомат аудиторії).	3.8005809783935547
These principles include, crucially, explicit legal protection for whistleblowers; as a consequence, they would be adequate for protecting democratic freedoms—if adopted completely and enforced without exception forever.	У ці принципи входить (що життєво важливо) явний юридичний захист інформаторів; як наслідок, ці принципи будуть адекватні захисту демократичних свобод — якщо їх приймуть у повному обсязі і будуть дотримуватися завжди і без винятків.	Ці принципи включають, критично, ясний законний захист для стукачів; як наслідок цього, вони були б відповідні для захисту демократичної свободи, якщо б були цілком прийняті й примусові без винятку назавжди.	1.3427884578704834	Ці принципи включають, щонайважливіше, чітку легальну захисту розповідачів; в результаті, вони були б адекватні для захисту демократичних свобод - якщо б вони були повністю приняті і втілені без винятків назавжди.	8.778317213058472	Ці принципи включають, критично, чіткий юридичний захист для стукачів; як наслідок цього, вони були б достатніми для захисту демократичних свобод, якщо б вони були прийняті повністю і примусові без винятку назавжди.	2.5313854217529297
A Nobel Peace Prize winner for his work on hunger, he once said: ‘You can’t build a peaceful world on empty stomachs and human misery.’	"Він отримав Нобелівську премію миру за свою працю, присвячену голоду, і одного разу сказав: ""Неможливо побудувати мирний світ на порожніх шлунках і людських нещастях""."	"Лауреат Нобелівської премії миру за свою працю про голод, він якось сказав: "" Ви можете створити мирний світ на голодному животі та людських стражданнях."	1.0511860847473145	"Він, лауреат Нобелівської премії за боротьбу з голодом, одного разу сказав: """" Ти не можеш побудувати мирний світ на порожніх шлунках та людському стражданні """"."	6.940857887268066	"Лауреат Нобелівської премії миру за свою працю з приводу голоду, він якось сказав: ""Ви можете побудувати мирний світ на пустому животі та людських стражданнях."	2.2886321544647217
Of the material in this article you will learn what it actually costs to pay money wedding photographer, and for what pay is not worth it.	З матеріалу даної статті Ви дізнаєтесь за що насправді варто платити гроші весільному фотографу, а за що платити не варто.	З матеріалу у цій статті ви дізнаєтесь, скільки насправді коштує плата за весільний фотограф, а зарплата того не варта.	0.9807207584381104	З матеріалів цієї статті ви дізнаєтесь, скільки насправді коштує заплатити за весіллі фотографа, і за те, що плата не варта цього.	5.252901315689087	З матеріалу у цій статті ви дізнаєтеся, скільки насправді коштує заплатити весільний фотограф за гроші, і за те, за яку плату не варто платити.	2.523683786392212
Sunrise and sunset time for Bourg-en-Bresse	Схід і захід сонця в Кормей-ан-Паризі	Час сходу сонця і заходу сонця для Бург-ен- Бресс	0.4464709758758545	Час виходу та заходу сонця в Bourg-en-Bresse	3.0670721530914307	Час сходу сонця та заходу сонця для Бург-ен- Брессе.	1.5146560668945312
"But the yellow hare, jars with soda, the layout of the letter ""A"", bright towels, a toy cactus and other elements became colored splashes of joy and creativity on all surfaces of the apartment."	А ось жовтий заєць, баночки з газованою водою, макет літери «А», яскраві рушники, іграшковий кактус і інші елементи стали кольоровими бризками радості і креативу на всіх поверхнях квартири.	"Але жовтий заєць, глеки з содовою, розклад букви ""А,"" яскраві рушники, іграшковий кактус та інші елементи стали кольоровими сплесками радості і творчості на всіх поверхнях квартири."	1.3929691314697266	"Але жовтий равлик, банки з содой, розкладання літери """" А """", яскраві рушники, іграшковий kaktus та інші елементи стали кольоровими краплями радості та творчості на всіх поверхностях квартири."	8.432092189788818	"Але жовтий заєць, глеки з содовою водою, розклад букви ""А"", яскраві рушники, іграшковий кактус та інші елементи стали кольоровими плесками радості та творчості на всіх поверхнях квартири."	4.552434921264648
"In addition to academic experts in the working group will also include Hirohisa Koyama, owner of the restaurant of national cuisine ""Aoyagi""; Kiyomi Mikuni, chef and owner of the hotel Hotel de Mikuni; Nobuyuki Ota, head of interior fashion ""Issey Miyake"", as well as fashion designer Yumiko Hara and designer Akira Minagawa."	"Крім академічних експертів, до складу робочої групи також увійдуть Хірохиса Кояма, власник ресторану національної кухні ""Аоягі""; Києм Мікуні, шеф-кухар і власник готелю Hotel de Mikuni; Нобуюкі Ота, керівник салону моди ""Іссей Міяке""; а також художник-модельєр Юмико Хара і дизайнер Акіра Мінагава."	"На додачу до академічних експертів цієї групи також належатимуть Хірогіса Кояма, власник ресторану національної кухні ""Анойагі""; Куімі Мікуні, шеф-кухар і власник готелю де Мікуні; Нобуюкі Ота, керівник внутрішньої моди ""Іссей Міяк,"" а також дизайнер моди Юміко Хара та дизайнер Акіра Мінагагава."	2.646926164627075	"Наряду з академічними експертами в цій групі також будуть присутні власник ресторану національної кухни """" Ояґі """", Хирохіса Кояма, шеф-повар та власник отеля """" Отель де Мікуні """", Кіомі Мікуні, Nobuyuki Ota, голова дизайну інтер 'єру """" Іссей Міяке """", а також дизайнер Юміко Хара та дизайнер Акира Minagawa."	16.266393184661865	"Окрім академічних експертів у робочій групі, до складу готелю де Мікуні також входитимуть Хірогіса Кояма, власник ресторану національної кухні ""Айойагі""; Кіімі Мікуні, шеф-кухар і власник готелю де Мікуні; Нобуюкі Ота, голова внутрішньої моди ""Ізі Міяк,"" а також дизайнер моди Юміко Хара та дизайнер Акіра Мінагава."	8.25782060623169
August 8, 1614 - Lviv official Jan Swoszowski of the Gryf coat of arms (XVI-1615), the founder of the city of Ivano-Frankove, founded the parish of Blessed Virgin Mary, Saint Michael Archangel and Saint John the Baptist.	8 серпня 1614 - львівський писар і землянин Ян Свошовський гербу Гриф (XVI-1615), засновник міста Янів, зафундував латинську парафію Пресвятої Діви Марії, Св. Архангела Михаїла та Св. Йоана Хрестителя.	8 серпня 1614 року офіційний працівник Львова Ян Свошовський з 22-го шару зброї (XVI-1615), засновник міста Івано-Франков, заснував парафію Благословенної Діви Марії, святого Михаїла Архангела і Святого Івана Хрестителя.	1.8765578269958496	8 серпня 1614 - Львовський чиновник Жан Сwoszowski з гербу Ґріфа (XVI-1615), засновник міста Ивано-Франкове, заснував приход Пресвятої Богородици, святого Михаила-Архангела і святого Іоанна Крестителя.	10.305520296096802	8 серпня 1614 року офіційний працівник Львова, Ян Свошовський з германського шару зброї (XVI-1615), засновник міста Івано-Франкове, заснував парафію Благословенної Діви Марії, святого Майкла Архангела та Святого Івана Хрестителя.	5.140279531478882
Numerous users have become permanent residents of the new created world and made it so popular that it prompted the production of related products with logos on hats, T-shirts, cups, mouse pads for computers.	Численні користувачі стали постійними мешканцями нового створеного світу і зробили його популярним настільки, що це послужило приводом для виробництва супутніх товарів з емблемами на кепках, футболках, чашках, килимках для комп'ютерної мишки.	Чимало користувачів стали постійними жителями нового світу, і це зробило його настільки популярним, що викликало виробництво споріднених товарів з логотипами на капелюхах, футболках, чашках, мишаних подушках для комп'ютерів.	1.3248610496520996	Багато користувачів стали постійними жителями нового творчого світу і зробили його таким популярним, що він спричинив виробництво відповідних продуктів з логотипами на капелюхах, футболках, чашках, мишах для комп 'ютерів.	8.232973337173462	Багато користувачів стали постійними жителями нового світу, створеного, і зробили його настільки популярним, що це спонукало виробництво споріднених товарів з логотипами на капелюхах, футболках, чашках, мишах для комп'ютерів.	3.6902616024017334
The Bachelor of Information Technology (Hons) course has a core of Information Technology (IT) subjects complemented with a selection from a wide range of subjects that includes the latest advances in IT skills, concepts, and applications (eg object-oriented analysis and design, multimedia, networking, data communications and internet publishing).	Бакалавр інформаційних технологій (з відзнакою), звичайно, має ядро суб'єктів інформаційних технологій (ІТ), доповнений з вибором з широкого кола питань, який включає в себе останні досягнення в області ІТ-навичок, концепцій і програм (наприклад, об'єктно-орієнтований аналіз і проектування, мультимедіа, робота в мережі передачі даних і інтернет-видавництво).	"У "" Біштарі інформаційної технології "" (Гонс) є основа інформаційної технології (IT) об'єктів, які доповнюють вибір з широкого спектру тем, які включають останні досягнення у IT-техніці, концепції та програмах (наприклад, об'єктно-орієнтований аналіз і дизайн, мультимедіа, мережа, обмін даними та оприлюднення інтернету)."	2.534964084625244	Bachelor of Information Technology (Hons) курс має ядро предметів індустрії інформаційних технологій (ІТ), до яких додається вибір з широкого спектру предметів, що включають найновіші досягнення в комп 'ютерних вичках, концепціях та застосуванні (например, орієнтований на об' єкти аналіз та дизайн, мультимедий, мережеві мережі, зв 'язки з даними та інтернет-друк).	14.644084215164185	Колектор інформаційної технології (Гонс) має основу інформаційної технології (IT), яка доповнює об'єктами з широкого спектру тем, які включають останні досягнення у IT-техніці, концепційах та програмах (наприклад, об'єктно-орієнтований аналіз та дизайн, мультимедіа, мережа, комунікація та інтернет-публікація).	7.516186475753784
However, all problems are corrected in time with the help of timely updates.	Однак всі проблеми вчасно виправляються за допомогою своєчасних оновлень.	Однак усі проблеми вчасно виправляють за допомогою своєчасних оновлень.	0.4203352928161621	Однак, всі проблеми виправляються вчасно за допомогою вчасних оновлень.	3.0698769092559814	Однак усі проблеми вчасно виправляють за допомогою своєчасних оновлень.	1.279392957687378
If the airline pays the compensation or provides the services as provided in this Article, no provision of this Article shall be construed as such that states that the airline has recognized its fault or as limiting its right to demand compensation by way of recourse from any entity, including third parties, under the applicable legislation of the state of departure/arrival of the flight.	У разі, якщо авіакомпанія виплачує компенсацію або надає послуги, передбачені цим розділом, жодне положення цього розділу не може тлумачитись як таке, що авіакомпанія визнала свою вину або обмежує її права вимагати компенсації у порядку регресу від будь-якої особи, включаючи третіх осіб, згідно з діючим законодавством країни відправки/прибуття рейсу.	Якщо авіакомпанія виплатить компенсацію або надасть послуги, як це показано у цій статті, то ніхто не зможе зафіксувати цю статтю так, щоб вона повідомила про свою провину або обмежила право вимагати компенсації шляхом виключення з будь-якого об'єкта, у тому числі з третьою стороною, під відповідним законодавством штату від'їзд/у польоту.	2.4551186561584473	Якщо авіалінія оплачує компенсацію або надає послуги, як це зазначено у цьому artykule, то жодне положення цього artykułу не можна інтерпретувати як таке, що стверджує, що авіалінія признала свою провину, або як таке, що обмежує її право вимагати компенсації шляхом recursoу від будь-якого podmiotу, включно з третьими сторонами, відповідно до розповсюджених законів країни відправления / прибытня польоту.	17.073813676834106	Якщо авіакомпанія платить компенсацію або надає послуги, як це показано у цій статті, не слід використовувати жодних заходів цієї статті, як таких, що кажуть, що авіакомпанія розпізнала свою провину або обмежила своє право вимагати компенсації шляхом виключення з будь-якого об'єкта, включно з третьою стороною, у відповідному законодавстві штату від'їзд/арраляція польоту.	7.598733425140381
Successful use of the blue scale gives the room a sense of peace, and you will be given a long-awaited rest after a long working day	Вдале використання синьої гами наділяє кімнату почуттям умиротворення, а вам подарує довгоочікуваний відпочинок після тривалого робочого дня.	Успішне використання синього масштабу дає кімнату відчуття миру, і вам буде дано довгоочікуваний відпочинок після довгого робочого дня	0.8476142883300781	Успішно використання блакитного діаграми дає кімнаті відчуття миру, і після довгого робочого дня ви отримаєте довго очікуваний покой	5.2875165939331055	Успішне використання синього масштабу дає кімнату відчуття миру, і вам дадуть довгостроковий відпочинок після довгого робочого дня.	2.1357598304748535
