eng	uk	helsinki_translation_en_uk	helsinki_time_en_uk	facebook_translation_en_uk	facebook_time_en_uk	helsinki_translation_fine_tuned	helsinki_time_fine_tuned
See also the weather conditions in Jordan country	Дивіться також погоду в країні Йорданія	Прочитайте також про погодні умови в Йордані.	0.9577507972717285	Подивіться також на погоду в країні Іорданія	2.4246110916137695	Також можна побачити погодні умови в Йорданській країні.	0.7080283164978027
"To set this ""Desktop Pictures - Ships, #27123"" as wallpaper background on your desktop, select above resolution links, then click on the ""Download"" button to save image on your desktop computer."	Щоб встановити цю «Картинки для робочого столу - Кораблі, #27123» як фонову заставку для робочого столу, виберіть вищевказані параметри, а потім натисніть кнопку «Завантажити», щоб зберегти зображення на своєму комп'ютері.	"Щоб встановити це тло тла шпалер на стільниці, виберіть вище розв' язання, а потім натисніть кнопку "" Звантажити ,"" щоб зберегти зображення на вашому комп' ютері."	2.0029165744781494	"Для того, щоб надати """" Desktop Pictures - Ships, #27123 """" як тлі tapetи на вашому робочому столі, виберите з góry посилання на роздільну здатність, а потім на """" Загрузити """" кнопку, щоб зберегти зображення на вашому робочому комп 'ютері."	10.566590547561646	"Щоб встановити цю "" Стільничні зображення - кораблі, # 27123 "" як тло тла шпалер на вашій стільниці, виберіть надписні посилання на роздільну здатність, а потім натисніть кнопку "" Завантажити ,"" щоб зберегти зображення на вашому комп' ютері."	4.448789119720459
For the laying laminate should prepare the following tools and materials:	Для укладання ламінату необхідно підготувати такі інструменти та матеріали.	Для латання слід підготувати такі інструменти і матеріали:	0.7931015491485596	Для укладки ламінatu треба підготуватися до наступних інструментів та матеріалів:	2.848914861679077	Для встановлення латки має приготувати такі інструменти та матеріали:	0.8934931755065918
Before him there is a choice - to go to a public or private clinic.	Перед ним стоїть вибір - піти в державну або приватну клініку.	Перед ним є вибір - піти до публічної або приватної клініки.	1.0342237949371338	Перед ним є вибір - ходити до публічної чи приватної клініки.	2.83963942527771	Перед ним є вибір: піти до публічної або приватної клініки.	1.2679924964904785
You are viewing the weather forecast in Kharagauli.	Ви дивитеся прогноз погоди у місті Хараґаулі.	Ви спостерігаєте прогноз погоди в Харараулі.	0.6642417907714844	Ви бачите прогноз погоды в Харагаули.	2.2932252883911133	Ви спостерігаєте прогноз погоди у Карарагулі.	1.0598738193511963
Space saving due to compact, narrow design	Економія місця завдяки компактній вузькій конструкції.	Заощадження у просторі через компактний, вузький дизайн	0.8983638286590576	Заощадження простору завдяки компактному, вузькому дизайну	2.33317232131958	Заощадження місця через компактний, вузький дизайн	1.225170373916626
The project was closed in 2010.	Проект був закритий у 2010 році.	Проект був закритий у 2010 році.	0.6664049625396729	Проект закритий в 2010 році.	1.4312388896942139	Проект був закритий у 2010 році.	0.8421940803527832
You will also have the option of turning off third party targeting/advertising cookies each time you see an advertisement that has been personalised to you.	У вас також буде можливість вимкнути сторонні таргетингові/рекламні файли cookie щоразу, коли ви бачите персоналізовану для вас рекламу.	Крім того, ви зможете вимкнути національну печивку, націлену на третю сторону, коли побачите рекламу, яка була індивідуальна для вас.	1.891401767730713	Ви також маєте можливість відключити третьі мішування / рекламні куки кожного разу, коли ви бачите рекламу, що була персоналізована для вас.	5.635675430297852	Ви також матимете можливість вимикати національні куки на третю сторону кожного разу, коли ви побачите рекламу, яка була індивідуальна для вас.	2.750582218170166
At the end of twelve months he was walking in the royal palace of Babylon.	На кінці дванадцяти місяців він проходжувався по царському палацу в Вавилоні.	При кінці дванадцятьох місяців він ходив у царському палаці Вавилону.	1.0228493213653564	В кінці двохнадцять місяців він йшов у королевський дворец Вавилон.	3.1501739025115967	При кінці дванадцятьох місяців він ходив у царському палаці Вавилону.	1.2209985256195068
Making the registration procedure of the trade mark, logo, slogan quick and unnoticeable for you, and the trade mark registration in Ukraine is such a work, which can be qualitatively performed by our patent agency Goldmark.	Зробити процедуру реєстрації торгової марки, логотипу, слогану швидкою і непомітною для вас, а реєстрацію торгової марки в Україні - такою роботою, яку може якісно виконати наше патентне агентство Goldmark.	Впроваджуючи реєстрацію торгової марки, логотипа, гасло, що швидко і невідповідне для вас, і реєстрація торгових знаків в Україні є такою роботою, яку може бути виконано нашою патентною агенцією Goldmark.	3.0676980018615723	Зробити процедуру rejestracji товарного знаку, логотипу, слоган швидкою і непомітною для вас, а також створення товарного знаку в Україні - це така робота, яку може качественно виконувати наша патентна агенція Goldmark.	8.040783166885376	Виготовлення процедури реєстрації торгової марки, логотипа, гасла, що швидко і невідповідне для вас, і реєстрація торгових знаків в Україні є такою роботою, яку може бути виконано нашою патентною агенцією Голдмарк.	3.8013393878936768
Dr. Inken Knief is a senior associate within the arbitration group of Hogan Lovells in Munich.	Доктор Інкен Кніф є старшим співробітником арбітражної групи «Хоган Лавеллз» у Мюнхені.	Доктор Інкен Кніф є старшим співучасником групи арбітації Гоґан Лавеллс у Мюнхені.	1.6920294761657715	Доктор Інкен Кніф - старший юрист в арбитражній групі Хогана Лавллса в Мюнхене.	4.6555070877075195	Д-р Інкен Кніф - старший помічник групи арбітерації Гоґан Лавеллс у Мюнхені.	1.7824187278747559
Why reject the assistance offered by specialists?	Навіщо відмовлятися від допомоги фахівців?	Чому ж відкидати допомогу, яку пропонують спеціалісти?	0.9502143859863281	Чому відмовитися від допомоги спеціалістів?	2.0438449382781982	Навіщо відкидати допомогу, яку пропонують фахівці?	1.0555698871612549
2018 During pregnancy, every mother is concerned with the question of how to choose the right bed for her baby.	2018 Під час вагітності кожну маму хвилює питання, як правильно вибрати ліжко для свого малюка.	2018 рік під час вагітності кожна мати занепокоєна тим, як вибрати добре ліжко для своєї дитини.	1.3249738216400146	2018 Під час вагітності кожна мати турбується про те, як вибрати правильне ліжко для свого малюка.	3.9057583808898926	2018 рік під час вагітності кожна мати занепокоєна питанням вибору відповідного ліжка для своєї дитини.	1.7137720584869385
Treaty of Paris on April 18, 1951 - the creation of the European Union of Coal and Steel, the beginning of the real economic and political integration of Europe.	Паризький договір 18 квітня 1951 р. - створення Європейського Об'єднання вугілля та сталі, початок реальної економічної та політичної інтеграції Європи.	Паризька угода 18 квітня 1951 року - створення Європейського Союзу вугілля і сталі - початку реальної економічної та політичної інтеграції Європи.	1.6754651069641113	Парижська угода 18 квітня 1951 року - створення Європейського союзу вугілля та сталі, початок справжньої економічної та політичної інтеграції Європи.	4.741516590118408	Паризька угода 18 квітня 1951 року - створення Європейського союзу вугілля та сталі, початок реальної економічної та політичної інтеграції Європи.	2.722167730331421
Fortunately, his hair almost does not shed.	На щастя, його шерсть майже не линяє.	На щастя, його волосся майже не пропадає.	0.9828412532806396	На щастя, його волосся майже не висипається.	2.0016629695892334	На щастя, його волосся майже не пропадає.	0.9618203639984131
Boats and ocean	Човни і океан	Човни та океани	0.33019280433654785	Парусники та океани	1.135986328125	Човни та океани	0.5310685634613037
75 Years of the Kirovohrad Oblast	75 років Кіровоградській області	75 років Кіровоградської області	0.9143872261047363	75 років Кировоградської области	1.3251278400421143	75 років Кіровоградового Областа.	1.1246294975280762
We are actively promoting the Christmas Fair, as well as the other attractions of the city.	Ми активно популяризуємо Різдвяний ярмарок та інші туристичні атракціони міста.	Ми активно сприяємо різдвяному ярмарку, а також іншим принадам міста.	1.0171864032745361	Ми активно пропагуємо Різдво, а також інші достопримечательности міста.	2.998936653137207	Ми активно просуваємо різдвяний ярмарок, а також інші принади міста.	1.7235591411590576
And by creating more space in your life, you become happier and more open to new opportunities, ones more suited to your new lifestyle.	Створюючи більше простору у своєму житті, ви стаєте щасливішими та більш відкритими до нових можливостей, які більше відповідають вашому новому стилю життя.	І створюючи більше місця у своєму житті, ви стаєте щасливішими і відкритішими до нових можливостей, більш пристосованими до нового способу життя.	1.690965175628662	І створюючи більше простору у своєму житті, ви стаєте щасливішими і відкритішими до нових можливостей, більш підходящих до вашого нового стилю життя.	5.585813760757446	Створюючи більше місця у своєму житті, ви стаєте щасливішими і відкритішими до нових можливостей, більш пристосованими до вашого нового способу життя.	2.700958728790283
This event is traditional for Scandinavian Gymnasium. 	Це свято є традиційним для Скандинавської гімназії.	Ця подія є традиційною для скандинавського гімнасія.	0.5581145286560059	Ця подія є традиційною для Скандинавського gymnasiumу.	2.8497209548950195	Ця подія є традиційною для скандинавського гімназіуму.	1.3002760410308838
Pure competition – the kind that can be attributed to perfect competition.	Чиста конкуренція – такий вид, що можна віднести до ідеальної конкуренції.	Чиста конкуренція ⇩ Різновид, який можна приписати досконалому конкуренцію.	0.6549167633056641	Чиста конкуренція - це те, що можна приписувати ідеальному змаганням.	3.07730770111084	Чиста конкуренція ♫ вид, який можна вважати ідеальною конкуренцією.	1.6908249855041504
Most of the time, the terms ball and sphere are used as the same.	Найчастіше терміни «куля» і «сфера» використовують як синоніми.	"Більшість часу терміни "" кулька "" і "" сфера "" використовуються як однакові."	0.5862538814544678	"Найчастіше терміни """" кулька """" та """" сфера """" використовуються як одне і те саме."	4.0270836353302	"Більшу частину часу терміни "" бал "" і "" сфера "" використовуються як однакові."	1.5555059909820557
Retrospectives of famous documentaries, master classes and an educational human rights campaign were held as part of the festival’s program.	У рамках програми фестивалю відбулися ретроспективи відомих документальних фільмів, майстер-класи та просвітницька правозахисна кампанія.	Ретроспективи відомих документальних фільмів, вищих класів та навчальної кампанії з прав людини були проведені як частина програми фестивалів.	0.9558727741241455	В рамках програми фестивалю проводилися ретроспективы відомих документальних фільмів, мастер-класи та освітня кампанія за права людини.	4.770045042037964	Ретроспективи відомих документальних фільмів, найкращих класів та навчальної кампанії з прав людини були проведені як частина програми фестивалів.	2.881744623184204
Militancy of Sparta residents can be explained by the fact that the Spartans being a very small nation (about ten thousand people), in their military strength they seen only way to survive.	Войовничість жителів Спарти можна пояснити тим, що спартанці, будучи дуже нечисленним народом (близько десяти тисяч осіб), бачили у своїй військовій силі єдиний спосіб вижити.	Милість мешканців Спарти можна пояснити тим, що спартанці були дуже маленькою нацією (близько десяти тисяч чоловік), у своїй військовій силі вони бачили лише спосіб вижити.	1.186497449874878	Мілліанність жителів Спарти можна пояснити тим, що Спартанці, будучи дуже маленькою нацією (приблизно 10 тисяч людей), в своїй військовій потужності бачили лише спосіб вижити.	7.339399576187134	Милість мешканців Спарти можна пояснити тим, що спартанці були дуже маленькою нацією (близько десяти тисяч людей) у своїй військовій силі, вони бачили лише спосіб вижити.	3.8435070514678955
Nearly all of these devices make use of a rotating magnetic field but from time to time linear alternators are also used.	Майже всі ці пристрої використовують обертове магнітне поле, але іноді застосовуються і лінійні генератори.	Майже всі ці прилади використовують магнітне поле, що обертається, але час від часу використовують також лінійні деформатори.	1.1231088638305664	Майже всі ці пристрої використовують обертене магнітне поле, але час від часу також використовують лінійні альтернативери.	4.495625257492065	Майже всі ці пристрої використовують магнітне поле, що обертається, але час від часу використовуються також лінійні декоратори.	2.110213041305542
The rigidity of the construction of the bar and sheets of shingles assumes the use of seals for installation.	Жорсткість конструкції планки та листів черепиці передбачає використання ущільнювачів під час монтажу.	Твердість конструювання та простирадла, яку використовують для встановлення печаток, належить до того, що вони були твердими.	2.0399222373962402	Нестабільність конструювання шипника та листів шинглів передбачає використання герметиків для монтажу.	4.378061056137085	Негнучкість конструювання та простирадла припускає, що для встановлення печаток використовують печатки.	2.0013551712036133
Saturday, September 30, 2017 in San Gennaro Vesuviano the weather will be like this:	У суботу, 30 вересня 2017 року, в Сан-Дженнаро-Везувіано погода буде такою:	У суботу, 30 вересня 2017 року в Сан - Геннаро Везувіаньо погода буде такою:	1.6579911708831787	Суббота, Сентябрь 30, 2017 в Сан Ґеннаро Весувіано погода буде така:	4.167117357254028	У суботу, 30 вересня 2017 року в Сан-Ганнаро Везувіано погода буде такою:	2.232971668243408
I've lost my job and am behind on my mortgage. It scares me that I could lose my home.	Я втратив роботу і затримав свою іпотеку. Мене лякає, що я можу втратити дім.	Я втратив роботу і тепер маю іпотеку, бо боюся втратити дім.	1.1004574298858643	Я втратила роботу і занедбала свою заставу. Мене лякає те, що можу втратити дім.	4.104945421218872	Я втратив роботу і залишився на іпотеці. Це лякає мене, що я можу втратити свій дім.	2.1156184673309326
I find it hard to concentrate at work, my thoughts scatter, and deadlines only increase my anxiety. It feels like I’m failing.	Мені важко зосередитися на роботі, думки розбігаються, а дедлайни тільки посилюють тривогу. Відчуття, що я не справляюся.	Мені важко зосереджуватися на роботі, мої думки розпорошуються, і кінцеві терміни лише збільшують мою тривогу.	1.9839985370635986	Мені важко зосередитися на роботі, мої думки розповсюджуються, і терміни лише збільшують мою тривогу. Мені здається, що я провалююсь.	5.990493059158325	Мені важко зосереджуватися на роботі, мої думки розсіюються, а термінові терміни лише збільшують мою тривогу. Таке відчуття, ніби я роблю певні кроки.	2.929845094680786
Lately, I feel constantly tired, even if I get enough sleep. 	Останнім часом відчуваю постійну втому, навіть якщо добре висплюся. 	Останнім часом я почуваюсь постійно втомленою, навіть якщо маю достатньо сну.	0.7758209705352783	Останнім часом я відчуваю себе постійно втомленою, навіть якщо в мене достатньо спить.	3.2779953479766846	Останнім часом я почуваюся постійно втомленою, навіть якщо достатньо сплю.	1.5754268169403076
I have so many thoughts in my head that I can’t sleep. It’s like my brain won’t shut off.	У мене стільки думок у голові, що я не можу заснути. Наче мозок не вимикається.	У мене так багато думок в голові, що я можу спати.	0.9614894390106201	У мене в голові стільки думок, що я не можу спати. Це ніби мій мозок не замкнеться.	4.057202577590942	У мене так багато думок у голові, що я можу спати.	1.893296241760254
